{"$id":"https://agent-development-skills.local/design/design-system-registry-v1.schema.json","$schema":"https://json-schema.org/draft/2020-12/schema","additionalProperties":false,"properties":{"binding_refs":{"items":{"minLength":1,"type":"string"},"type":"array","uniqueItems":true},"components":{"additionalProperties":{"additionalProperties":false,"properties":{"motion":{"type":"object"},"slots":{"items":{"minLength":1,"type":"string"},"type":"array","uniqueItems":true},"states":{"items":{"minLength":1,"type":"string"},"type":"array","uniqueItems":true},"token_refs":{"items":{"minLength":1,"type":"string"},"type":"array","uniqueItems":true},"variants":{"items":{"minLength":1,"type":"string"},"type":"array","uniqueItems":true}},"required":["variants","slots","token_refs","states","motion"],"type":"object"},"type":"object"},"fingerprint":{"pattern":"^design-v1:[0-9a-f]{64}$","type":"string"},"registry_id":{"minLength":1,"type":"string"},"schema_version":{"const":"1.0"},"tokens":{"type":"object"},"version":{"minLength":1,"type":"string"}},"required":["schema_version","registry_id","version","tokens","components","binding_refs","fingerprint"],"title":"Design System Registry v1","type":"object"}
