{"binding_refs":["apple-settings-v1"],"components":{"button":{"motion":{},"slots":["label"],"states":["default","disabled","pressed"],"token_refs":["color.action.primary"],"variants":["primary"]}},"fingerprint":"design-v1:b7fe65f0103bfaa6300375a48262b36584f42f4ebe5dedccd7af0bd6c6f66fab","registry_id":"shared-default","schema_version":"1.0","tokens":{"color.action.primary":{"semantic":"action-primary"}},"version":"1.0.0"}
